tweet_id	text	processed_urls	round	confs	cat1_answers	cat1_mean_answer	cat1_final_answer	cat2_answers	cat2_mean_answer	cat2_final_answer	cat3_answers	cat3_mean_answer	cat3_final_answer	compoundclaim_answers	compoundclaim_mean_answer	compoundclaim_final_answer	ironic_answers	ironic_mean_answer	ironic_final_answer	cat1_explanation	cat2_explanation	cat3_explanation	explanation	cat1_score	cat2_score	cat3_score	len_scibert_embed	len_bertweet_embed	embed_len_diff
316669998137483264	Knees are a bit sore. i guess that's a sign that my recent treadmilling is working	[]	1	1.0 1.0 1.0 0.5	1 0 0 0	0.25	0.0	0 0 0 0	0.0	0.0	0 0 0 0	0.0	0.0	0 0 0 0	0.0	0.0	0 0 0 0	0.0	0.0					0.8363166999999999			24	24	0
319090866545385472	McDonald's breakfast stop then the gym 🏀💪	[]	1	1.0 1.0 1.0 1.0	0 0 0 0	0.0	0.0	0 0 0 0	0.0	0.0	0 0 0 0	0.0	0.0	0 0 0 0	0.0	0.0	0 0 0 0	0.0	0.0								22	20	2
322030931022065664	Can any Gynecologist with Cancer Experience explain the dangers of Transvaginal Douching with Fluoride or other toxins such as Dioxin? #PDX	[]	2	1.0 0.5 1.0 0.0	1 1 1 0	0.75	1.0	0 0 0 0	0.0	0.0	0 0 1 0	0.25	0.0	0 0 0 0	0.0	0.0	0 0 0 0	0.0	0.0					0.9924461		0.08446733	35	34	1
322694830620807168	Couch-lock highs lead to sleeping in the couch. Gotta stop doing this shit.	[]	1	0.5 0.0 1.0 0.0	0 1 1 1	0.75	1.0	0 0 0 0	0.0	0.0	0 0 0 0	0.0	0.0	0 0 0 1	0.25	0.0	1 0 1 0	0.5	0.5					0.004717379			24	19	5
328524426658328576	Does daily routine help prevent problems with bipolar disorder http://t.co/XGUfUDoLJB	['http://www.helium.com/items/1462930-daily-routine-and-bipolar-disorder']	1	1.0 0.5 0.5 0.5	1 1 1 1	1.0	1.0	0 0 1 0	0.25	0.0	0 0 1 0	0.25	0.0	0 0 0 0	0.0	0.0	0 0 0 0	0.0	0.0						0.1493405	0.46608558	11	11	0
330512111509852160	Dr Swanson: GMOs and Roundup Increase Chronic Diseases, Infertility and Birth Defects http://t.co/3c8fj0ZY2t	['https://fb.me/249gATgTE']	1	1.0 1.0 1.0 1.0	1 1 1 1	1.0	1.0	1 0 1 0	0.5	0.5	1 0 1 1	0.75	1.0	1 0 0 0	0.25	0.0	0 0 0 0	0.0	0.0						0.0030408327	0.049765006	19	19	0
331396203700944896	The Impact of Infertility on You and Your Relationship http://t.co/7pF7Z0wH8f	['http://www.momatlast.com/infertility/the-impact-of-infertility-on-you-and-your-relationship/']	2	1.0 0.0 0.0 0.0	0 1 0 0	0.25	0.0	0 0 0 0	0.0	0.0	0 0 0 1	0.25	0.0	0 0 0 0	0.0	0.0	0 0 0 0	0.0	0.0	claim component explained by link			Link shows the impactof infertility on you and your relationship	0.4297496		0.23627503	11	12	-1
332684622561423360	Research published in Human Reproduction reports that men who eat an average of HALF A SERVING OF SOY FOODS daily... http://t.co/va3vZBMpMS	['https://www.facebook.com/login/?next=https%3A%2F%2Fwww.facebook.com%2FSeriousSupplements%2Fposts%2F563033143727651']	1	1.0 0.5 0.5 0.0	1 0 0 1	0.5	0.5	0 1 1 0	0.5	0.5	1 1 1 1	1.0	1.0	0 0 0 0	0.0	0.0	0 0 0 0	0.0	0.0	missing claim component				0.9969976	0.9818615		25	23	2
333266791960809472	“Traffic Jam” In Brain’s Neurons Could Be Cause Of Statin-Related Cognitive Decline http://t.co/kQ3XPdePKX	['https://www.redorbit.com/news/health/1112844192/statin-cholesterol-drugs-cognitive-decline-brain-neurons-051113/']	1	0.5 1.0 1.0 0.5	1 1 1 1	1.0	1.0	1 1 1 0	0.75	1.0	1 1 1 0	0.75	1.0	0 0 0 1	0.25	0.0	0 0 0 0	0.0	0.0						0.99286646	0.9958333	20	21	-1
334282732085587968	Can playing more games improve lives and save the world? by @chris_pelle via @PostArcade http://t.co/uEtVu099Ad #CDA30	['https://financialpost.com/?p=320854']	2	1.0 0.5 1.0 1.0	1 1 1 1	1.0	1.0	0 0 0 0	0.0	0.0	0 0 0 0	0.0	0.0	0 0 1 0	0.25	0.0	0 0 0 0	0.0	0.0								19	18	1
334350038090276864	The effect of climate change on iceberg production by Greenland glaciers http://t.co/CtnPhcmD7c	['https://www.terradaily.com/reports/The_effect_of_climate_change_on_iceberg_production_by_Greenland_glaciers_999.html']	2	1.0 0.0 1.0 0.5	0 1 0 0	0.25	0.0	1 1 1 0	0.75	1.0	1 1 1 0	0.75	1.0	0 0 0 0	0.0	0.0	0 0 0 0	0.0	0.0	claim component explained by link			Link shows the effect that climate change has on iceberg production	0.69963676	0.98895216	0.9955684	17	16	1
335542235452014594	@HankAzaria @TheSimpsons oh loneliness and cheeseburgers are a dangerous mix	[]	1	1.0 1.0 1.0 0.5	0 0 0 1	0.25	0.0	0 0 0 0	0.0	0.0	0 0 0 0	0.0	0.0	0 0 0 0	0.0	0.0	1 0 0 1	0.5	0.5					0.02512991			13	11	2
336431788618551297	#bbcsportsday Honestly think Liverpool are a left back and a right wing away from CL. Fabio Coentrao and James Rodriguez?	[]	1	1.0 1.0 1.0 1.0	0 0 0 0	0.0	0.0	0 0 0 0	0.0	0.0	0 0 0 0	0.0	0.0	0 0 0 0	0.0	0.0	0 0 0 0	0.0	0.0								34	32	2
339453990179844097	@bpkelly12 if that damn book lady decides to stop being a fuckin retard ill be out of here in 2 days	[]	1	1.0 1.0 1.0 1.0	0 0 0 0	0.0	0.0	0 0 0 0	0.0	0.0	0 0 0 0	0.0	0.0	0 0 0 0	0.0	0.0	0 0 0 0	0.0	0.0								25	22	3
339558700970815488	Science sucks.	[]	2	1.0 0.5 1.0 1.0	0 0 0 1	0.25	0.0	0 0 0 0	0.0	0.0	0 1 0 0	0.25	0.0	0 0 0 0	0.0	0.0	0 0 0 0	0.0	0.0					0.0041182763		0.0011050815	6	5	1
342204279160987648	http://t.co/eJlnUg0Gog Pay attention to classification essays format	['http://essay911.org/15344-pay-attention-to-classification-essays-format.html']	1	1.0 1.0 1.0 1.0	0 0 0 0	0.0	0.0	0 0 0 0	0.0	0.0	0 0 0 0	0.0	0.0	0 0 0 0	0.0	0.0	0 0 0 0	0.0	0.0								9	8	1
344256820552011777	@RepCohen @SenAlexander @SenBobCorker pls support #NIH funding to help fight #pancreaticcancer @PanCAN @PanCANMemphis #ifight4MyDad	[]	1	0.5 0.0 1.0 1.0	0 0 0 0	0.0	0.0	0 0 0 0	0.0	0.0	1 1 1 1	1.0	1.0	0 0 0 0	0.0	0.0	0 0 0 0	0.0	0.0								21	20	1
344906283360591873	Poverty is the greatest cause behind child labour. #RisePakistan	[]	1	1.0 1.0 1.0 0.5	1 1 1 1	1.0	1.0	0 0 0 0	0.0	0.0	0 0 0 0	0.0	0.0	0 0 0 0	0.0	0.0	0 0 0 0	0.0	0.0								16	14	2
345226308780974081	"""@TheFactsBook: Drinking chocolate milk has been proven to help relieve muscle soreness after a workout.""@dietervoigtsa dink jy dis waar?"	[]	2	0.5 1.0 1.0 1.0	1 1 1 1	1.0	1.0	0 0 0 0	0.0	0.0	0 0 0 0	0.0	0.0	0 0 0 1	0.25	0.0	0 0 0 0	0.0	0.0								30	27	3
346130801726988290	About to just go to bed maybe cry a little and maybe stop breathing okay? Okay.	[]	1	1.0 1.0 1.0 1.0	0 0 0 0	0.0	0.0	0 0 0 0	0.0	0.0	0 0 0 0	0.0	0.0	0 0 0 0	0.0	0.0	0 0 0 0	0.0	0.0								22	20	2
348110995861954560	"""@GreatestNotes: Stop searching for the right person. Just look for a good catcher.The one who could catch your heart when it starts falling"	[]	1	1.0 1.0 1.0 1.0	0 0 0 0	0.0	0.0	0 0 0 0	0.0	0.0	0 0 0 0	0.0	0.0	0 0 0 0	0.0	0.0	0 0 0 0	0.0	0.0								30	29	1
349083884803198976	"HM Revenue defines tax evasion as ""serious"" when sum involved is higher than £50,000 worthy of prosecution. http://t.co/BN3MEqJWvV"	['http://www.bbc.co.uk/news/business-23020508']	1	0.5 1.0 1.0 1.0	0 0 0 0	0.0	0.0	0 0 0 0	0.0	0.0	0 0 0 0	0.0	0.0	0 0 0 0	0.0	0.0	0 0 0 0	0.0	0.0								27	23	4
349307668546068481	The best reader is Braille reader. Hats off. Senses lead to imagination. #Terfaktab	[]	1	1.0 0.5 1.0 1.0	0 0 1 1	0.5	0.5	0 0 0 0	0.0	0.0	0 0 0 0	0.0	0.0	0 0 1 1	0.5	0.5	0 0 0 0	0.0	0.0					0.0019812027			25	22	3
350116212899971073	ThE Lazy Marketer Increase riches. How to be a leader. How to be recognized. Get protected. Chino Hills California	[]	1	1.0 1.0 0.5 0.5	0 0 0 0	0.0	0.0	0 0 0 0	0.0	0.0	0 0 0 0	0.0	0.0	0 0 0 0	0.0	0.0	0 0 0 0	0.0	0.0								30	27	3
350649661289275393	God dammit ... Poor decisions lead to negative consequences. Won't happen again	[]	1	1.0 0.5 1.0 0.5	1 0 0 0	0.25	0.0	0 0 0 0	0.0	0.0	0 0 0 0	0.0	0.0	0 0 0 0	0.0	0.0	0 0 0 0	0.0	0.0	very general				0.9962098			21	16	5
352112687028768770	New post outlining SOLO mapping activity for Science http://t.co/uLArqkGCT8 Perhaps useful for other subjects too.	['http://www.betterscience.co.uk/betterscience-blog.html']	1	0.0 0.0 0.0 1.0	1 0 0 0	0.25	0.0	1 0 0 0	0.25	0.0	1 0 0 0	0.25	0.0	0 0 0 0	0.0	0.0	0 0 0 0	0.0	0.0					0.0019357199	0.004075867	0.5991279	19	18	1
354781851375763456	Girls with asses big enough to cause a pile up #BSE and #TooLive Presents #XXXplicit #July19 @ 814 S. Dixie hwy, Hollywood, FL 33020 Time 9	[]	1	1.0 1.0 1.0 1.0	0 0 0 0	0.0	0.0	0 0 0 0	0.0	0.0	0 0 0 0	0.0	0.0	0 0 0 0	0.0	0.0	0 0 0 0	0.0	0.0								45	41	4
354971560186101763	A wise Physician said, “The best medicine for Humans is LOVE.” Some1 asked, “If it doesn’t work?” He smiled&answered, “ Increase the dose.”	[]	1	0.5 1.0 0.5 0.0	1 1 1 1	1.0	1.0	0 0 0 0	0.0	0.0	0 1 0 0	0.25	0.0	0 0 0 0	0.0	0.0	0 0 0 0	0.0	0.0							0.0014083914	42	41	1
357332201190334464	Zimmerman did not win the lotto ppl please stop spreading these Krazy rumors	[]	1	1.0 1.0 1.0 1.0	0 0 0 0	0.0	0.0	0 0 0 0	0.0	0.0	0 0 0 0	0.0	0.0	0 0 0 0	0.0	0.0	0 0 0 0	0.0	0.0								20	17	3
357516810666524675	When we think of unhealthy living we generally think of diet and exercise. Diet and exercise are an intricate... http://t.co/bGnam9Thx1	['https://fb.me/2HyVPuCHc']	2	0.5 0.0 0.5 1.0	1 0 1 1	0.75	1.0	0 0 0 0	0.0	0.0	0 0 0 0	0.0	0.0	0 0 0 0	0.0	0.0	0 0 0 0	0.0	0.0					0.9919579			27	23	4
358829145460969473	#BREAKING:Somalia: Al Shabab ambushes on Kenyan forces in Lower #Juba region http://t.co/h3OuYEpfoQ	['http://radiohaatuf.com/?p=4606']	1	1.0 1.0 1.0 1.0	0 0 0 0	0.0	0.0	0 0 0 0	0.0	0.0	0 0 0 0	0.0	0.0	0 0 0 0	0.0	0.0	0 0 0 0	0.0	0.0								25	22	3
359184948294467584	dude if people don't stop retweeting that fake frank ocean account..	[]	1	1.0 1.0 1.0 1.0	0 0 0 0	0.0	0.0	0 0 0 0	0.0	0.0	0 0 0 0	0.0	0.0	0 0 0 0	0.0	0.0	0 0 0 0	0.0	0.0								22	15	7
361218917303193600	Teach children to treat animals responsibly do not teach captivity! Join us http://t.co/UR15gQPatU #FreeAllCetacea via @FreeAllCetacea	['http://www.wdcs.org/']	1	1.0 1.0 1.0 0.5	0 0 0 0	0.0	0.0	0 0 0 0	0.0	0.0	0 0 0 0	0.0	0.0	0 0 0 0	0.0	0.0	0 0 0 0	0.0	0.0								24	23	1
362177441596321792	Caution! 3D Printers Could Cause Health Problems. Find out more here: http://t.co/BRAwvRgq28	['http://newsrule.com/caution-3d-printers-could-cause-health-problems/']	1	1.0 1.0 1.0 0.5	1 1 1 1	1.0	1.0	0 0 0 0	0.0	0.0	0 0 0 0	0.0	0.0	0 0 0 1	0.25	0.0	0 0 0 0	0.0	0.0								18	16	2
362864716030283777	#YouKnowYouInTheHoodWhen u see taggings all over the stop signs and shit	[]	1	1.0 1.0 1.0 1.0	0 0 0 0	0.0	0.0	0 0 0 0	0.0	0.0	0 0 0 0	0.0	0.0	0 0 0 0	0.0	0.0	0 0 0 0	0.0	0.0								22	19	3
363172565365170176	MDLinx Blog: MDLinx Blog: Neuropsychological findings in pediatric maltreatment: relationship of PTSD,... http://t.co/sS24IDHCoD	['https://www.mdlinx.com/psychiatry/news-article.cfm/4747463/?xml&utm_source=dlvr.it&utm_medium=twitter']	1	0.5 1.0 1.0 1.0	1 0 0 0	0.25	0.0	1 1 0 0	0.5	1.0	1 1 1 1	1.0	1.0	0 0 0 0	0.0	0.0	0 0 0 0	0.0	0.0		title of study (part)			0.19203302	0.99096894		28	30	-2
363719380967768064	RT @rgj: Barrick Gold reports $8.56 billion Q2 loss http://t.co/fuaTuAH54i	['https://eu.rgj.com/article/20130803/BIZ10/308030019/1459/news']	1	1.0 1.0 1.0 1.0	0 0 0 0	0.0	0.0	0 0 0 0	0.0	0.0	0 0 0 0	0.0	0.0	0 0 0 0	0.0	0.0	0 0 0 0	0.0	0.0								16	15	1
364157346026500096	Lemme stop talking anus	[]	1	1.0 1.0 1.0 1.0	0 0 0 0	0.0	0.0	0 0 0 0	0.0	0.0	0 0 0 0	0.0	0.0	0 0 0 0	0.0	0.0	0 0 0 1	0.25	0.0								8	6	2
368890097971654656	Mortgage Rates Continue Lower Ahead of... http://t.co/SfSvmYFJn7 #mortgage	['http://refiyes.com/news/2013/07/09/mortgage-rates-continue-lower-ahead-of-fed-minutes/']	1	1.0 1.0 0.0 0.5	1 0 0 0	0.25	0.0	0 0 0 0	0.0	0.0	0 0 0 0	0.0	0.0	0 0 0 0	0.0	0.0	0 0 0 0	0.0	0.0					0.0052421405			15	11	4
369497353503264768	"""@GeminisWeAre: # ZodiacAreUs: Lavender is the scent associated with #Gemini."" So that's the reason I LOVEEEEEEEE Lavended"	[]	1	1.0 1.0 1.0 1.0	0 0 0 0	0.0	0.0	0 0 0 0	0.0	0.0	0 0 0 0	0.0	0.0	0 0 0 0	0.0	0.0	0 0 0 0	0.0	0.0								37	32	5
369662835972141056	65% of cats born with blue eyes are deaf.	[]	2	1.0 1.0 1.0 1.0	1 1 1 1	1.0	1.0	0 0 0 0	0.0	0.0	0 0 0 0	0.0	0.0	0 0 0 0	0.0	0.0	0 0 0 0	0.0	0.0								13	13	0
371197661439078400	@najdi_outsider @mayami2012 @mol7daa @ahlamm4 @bibi_dd 1. The study indicate that the brain atrophy is caused by stress not by religion	[]	2	1.0 1.0 0.5 1.0	1 1 1 1	1.0	1.0	0 1 0 0	0.25	0.0	0 1 1 1	0.75	1.0	0 0 0 0	0.0	0.0	0 0 0 0	0.0	0.0		study wo reference				0.0014504679	0.80814546	18	19	-1
373473100715028480	"""@ralphmarston: Move beyond the need to blame, and you gain a greater degree of responsibility."""	[]	1	0.5 1.0 0.5 1.0	1 0 1 0	0.5	0.5	0 0 0 0	0.0	0.0	0 0 0 0	0.0	0.0	0 0 0 0	0.0	0.0	0 0 0 0	0.0	0.0					0.013311248			22	21	1
375481363668795392	Over thinking causes the mind to create negative scenarios and replay painful memories.	[]	1	1.0 1.0 1.0 1.0	1 0 1 1	0.75	1.0	0 0 0 0	0.0	0.0	0 0 0 0	0.0	0.0	0 0 0 0	0.0	0.0	0 0 0 0	0.0	0.0					0.9960946			17	16	1
375599373771898880	Sleep 'boosts brain cell numbers' http://t.co/5d9b6G1vob	['https://zedie.wordpress.com/2013/09/05/sleep-boosts-brain-cell-numbers-2/']	2	1.0 1.0 1.0 1.0	1 1 1 1	1.0	1.0	1 1 1 0	0.75	1.0	1 1 1 0	0.75	1.0	0 0 0 0	0.0	0.0	0 0 0 0	0.0	0.0						0.9774343	0.109403	10	9	1
375694265692594176	Please read this request and support this wonderful charity. Continue to pray for Helen Wade and Michelle... http://t.co/WIMFrbPfpA	['https://fb.me/27LiSJLj8']	1	1.0 1.0 1.0 1.0	0 0 0 0	0.0	0.0	0 0 0 0	0.0	0.0	0 0 0 0	0.0	0.0	0 0 0 0	0.0	0.0	0 0 0 0	0.0	0.0								29	22	7
377536039117934592	@mick_keeley omg stop ahahahah this is like year 5 sex ed	[]	1	1.0 1.0 1.0 1.0	0 0 0 0	0.0	0.0	0 0 0 0	0.0	0.0	0 0 0 0	0.0	0.0	0 0 0 0	0.0	0.0	0 0 0 0	0.0	0.0								16	12	4
378087292306337792	Versatile microRNAs Choke Off Cancer Blood Supply, Suppress Metastasis - Science Daily (press release) http://t.co/EFAfQCE57H	['https://consent.google.com/ml?continue=https://news.google.com/?sa%3Dt%26fd%3DR%26usg%3DAFQjCNEShhscXXuBsfRLjBKJG4dG2YU_GA%26url%3Dhttp://www.sciencedaily.com/releases/2013/09/130911103327.htm%26utm_source%3Ddlvr.it%26utm_medium%3Dtwitter%26hl%3Den-US%26gl%3DUS%26ceid%3DUS:en&gl=DE&hl=en-US&pc=n&src=1']	1	1.0 1.0 1.0 1.0	1 1 1 1	1.0	1.0	1 1 1 0	0.75	1.0	1 1 1 0	0.75	1.0	0 0 1 0	0.25	0.0	0 0 0 0	0.0	0.0		link to study				0.9858015	0.14903234	20	23	-3
378157554347827200	"Planned parenthood started as a eugenics organization. ""Birth control must lead ultimately to a cleaner race."" http://t.co/WE3uO5xoof"	['https://www.lifenews.com/2013/03/11/10-eye-opening-quotes-from-planned-parenthood-founder-margaret-sanger/']	1	1.0 1.0 0.5 1.0	1 0 0 1	0.5	0.5	0 0 0 0	0.0	0.0	0 0 0 0	0.0	0.0	0 0 0 0	0.0	0.0	0 0 0 0	0.0	0.0					0.9472793			26	24	2
378259375594680320	Nerd out on this sprawling oral history of Apple design http://t.co/NFc51YVkkp	['https://gizmodo.com/nerd-out-on-this-sprawling-oral-history-of-apple-design-1302371045?utm_campaign=socialflow_gizmodo_twitter&utm_source=gizmodo_twitter&utm_medium=socialflow']	1	1.0 1.0 1.0 1.0	0 0 0 0	0.0	0.0	0 0 0 0	0.0	0.0	0 0 0 0	0.0	0.0	0 0 0 0	0.0	0.0	0 0 0 0	0.0	0.0								15	13	2
379218265500684288	“@UberFacts: During Medieval times, red hair was associated with intense sexual desire and moral degradation.” @EElise13	[]	1	1.0 0.5 1.0 0.5	1 1 1 1	1.0	1.0	0 0 0 0	0.0	0.0	0 0 0 0	0.0	0.0	0 0 0 0	0.0	0.0	0 0 0 0	0.0	0.0								23	22	1
380010167581962240	@CODEREDDD God see and knw yr heart plus u are a fighter continue to stand strong...i'm praying for u!	[]	1	1.0 1.0 1.0 1.0	0 0 0 0	0.0	0.0	0 0 0 0	0.0	0.0	0 0 0 0	0.0	0.0	0 0 0 0	0.0	0.0	0 0 0 0	0.0	0.0								30	25	5
380341864903090176	"@billmaher What can ""we"" do Bill? All the gun laws in the fucking world won't stop mentally ill killers from killing people..."	[]	1	1.0 1.0 0.5 0.0	1 1 1 1	1.0	1.0	0 0 0 0	0.0	0.0	0 0 0 0	0.0	0.0	0 0 0 1	0.25	0.0	0 0 0 0	0.0	0.0								34	28	6
383207984014184448	Most Gun Dealers Support #ExpandedBackgroundChecks, Survey Says http://t.co/gO3TB1EWuf via @HuffPostPol Results of survey #NRA opposed.	['https://www.huffpost.com/entry/gun-dealers-support-background-checks_n_3986380?utm_hp_ref=tw']	1	1.0 1.0 1.0 1.0	1 1 0 0	0.5	0.5	1 1 0 0	0.5	0.5	1 1 0 0	0.5	0.5	0 0 0 0	0.0	0.0	0 0 0 0	0.0	0.0					0.007453444	0.0011382769	0.0010688675	25	24	1
384330219496017920	Yay, Bianca! MT @BZGarcia: Cancer sux! Show support for @andi_sloan & affect positive change now. Sign the petition! http://t.co/KA077fN0gD	['http://chn.ge/193b5DD']	1	1.0 1.0 0.5 0.5	0 0 0 0	0.0	0.0	0 0 0 0	0.0	0.0	0 0 0 1	0.25	0.0	0 0 0 0	0.0	0.0	0 0 0 0	0.0	0.0							0.00068383565	29	25	4
384405549905092608	This little bellend has to stop crying oh my god get a grip	[]	1	1.0 1.0 0.0 1.0	0 0 0 0	0.0	0.0	0 0 0 0	0.0	0.0	0 0 0 0	0.0	0.0	0 0 0 0	0.0	0.0	0 0 0 0	0.0	0.0								17	15	2
384881095906299904	Wavy - Pound Cake (Freestyle): https://t.co/G2Prq59YLL - Support this record. I'm not the one just to send you anything @BET	['https://soundcloud.com/wavydiego/wavy-poundcake-freestyle']	1	1.0 1.0 1.0 1.0	0 0 0 0	0.0	0.0	0 0 0 0	0.0	0.0	0 0 0 0	0.0	0.0	0 0 0 0	0.0	0.0	0 0 0 0	0.0	0.0								30	25	5
393776652653576193	Environmental Concerns Lead to Inhaler Change http://t.co/hbLo7fehZY	['https://www.rxwiki.com/news-article/chlorofluorocarbon-inhalers-used-asthma-and-copd-be-phased-out-fda?utm_source%3D3f60adf1-0502-4621-8815-16c5e5290edd%26utm_medium%3Drss%26utm_campaign%3Dshort=&utm_source=ValleyPharmacy&utm_medium=TPE-Twitter-RxWiki&utm_campaign=ValleyPharmacy']	1	0.5 0.5 1.0 0.5	1 1 1 1	1.0	1.0	1 0 1 0	0.5	0.5	1 0 1 0	0.5	0.5	0 0 0 0	0.0	0.0	0 0 0 0	0.0	0.0						0.97622395	0.8220181000000001	9	9	0
394131909032161280	The world stops for El Classico. Its the rules. Even stopped playing FIFA.	[]	1	1.0 1.0 1.0 1.0	0 0 0 0	0.0	0.0	0 0 0 0	0.0	0.0	0 0 0 0	0.0	0.0	0 0 0 0	0.0	0.0	0 0 0 0	0.0	0.0								20	19	1
394159135400263681	"This Guy Singing ""No Woman No Drive"" Is The Best Video To Support Saudi Women Challenging Driving Ban: “In thi... http://t.co/wRc40wKPFk"	['http://bit.ly/1c7eXF7']	1	1.0 1.0 1.0 1.0	0 0 0 0	0.0	0.0	0 0 0 0	0.0	0.0	0 0 0 0	0.0	0.0	0 0 0 0	0.0	0.0	0 0 0 0	0.0	0.0								30	28	2
396020068423065600	How To Fold A Suit, Shirt & Pants Together To Prevent Wrinkling - http://t.co/tLnnKTTKBU	['https://bitrebels.com/lifestyle/how-to-fold-suit-shirt-pants-together/']	1	1.0 1.0 1.0 1.0	0 0 0 0	0.0	0.0	0 0 0 0	0.0	0.0	0 0 0 0	0.0	0.0	0 0 0 0	0.0	0.0	0 0 0 0	0.0	0.0								20	17	3
396940972694568960	Modeling precision treatment of breast cancer - looks great ! http://t.co/4XzfGlwAWn	['http://genomebiology.com/2013/14/10/R110']	1	1.0 1.0 1.0 1.0	0 0 0 1	0.25	0.0	1 1 1 1	1.0	1.0	1 1 1 1	1.0	1.0	0 0 0 1	0.25	0.0	0 0 0 0	0.0	0.0					0.88675016			12	12	0
397206548943867905	@khushsundar Do u think legalising prostitution in all states will decrease sexual abusing. Pls give me s reply mam.	[]	1	1.0 0.0 0.5 1.0	1 1 1 1	1.0	1.0	0 0 0 0	0.0	0.0	0 0 0 0	0.0	0.0	0 0 1 1	0.5	0.5	0 0 0 0	0.0	0.0								26	23	3
398450991726485505	Aegon UK reports rise in earnings http://t.co/M3FRwylsZU	['https://www.bbc.co.uk/news/uk-scotland-scotland-business-24852864#sa-ns_mchannel=rss&ns_source=PublicRSS20-sa?utm_source=twitterfeed&utm_medium=twitter']	1	1.0 0.5 1.0 1.0	0 1 0 0	0.25	0.0	0 0 0 0	0.0	0.0	0 0 0 0	0.0	0.0	0 0 0 0	0.0	0.0	0 0 0 0	0.0	0.0					0.22715135			9	9	0
398716322193764352	@MC_Sincere those eyes are a gift send straight from God boy!!! Hahahaha	[]	1	1.0 1.0 1.0 1.0	0 0 0 0	0.0	0.0	0 0 0 0	0.0	0.0	0 0 0 0	0.0	0.0	0 0 0 0	0.0	0.0	0 0 0 0	0.0	0.0								19	16	3
398893112812392449	Amazon plans to lower the cost of processing big data in the cloud : http://t.co/GPpwtMqYlo #socialmedia	['http://socialmedia-nieuws.nl/algemeen-nieuws/amazon-plans-to-lower-the-cost-of-processing-big-data-in-the-cloud/']	1	0.5 1.0 1.0 1.0	0 0 0 0	0.0	0.0	0 0 0 0	0.0	0.0	0 0 0 0	0.0	0.0	0 0 0 0	0.0	0.0	0 0 0 0	0.0	0.0								19	17	2
402844901475618816	#Multiple #Births Cost Significantly More Than Single Births, Study Shows http://t.co/A0alATsStW	['https://www.foxnews.com/health/multiple-births-cost-significantly-more-than-single-births-study-shows']	2	1.0 1.0 1.0 0.0	1 1 1 0	0.75	1.0	1 1 1 0	0.75	1.0	1 1 1 0	0.75	1.0	0 0 0 0	0.0	0.0	0 0 0 0	0.0	0.0		article with link to study			0.9969581	0.9838881	0.987062	15	17	-2
402941487509671936	The taxi 12s are a must have	[]	1	1.0 1.0 1.0 1.0	0 0 0 0	0.0	0.0	0 0 0 0	0.0	0.0	0 0 0 0	0.0	0.0	0 0 0 0	0.0	0.0	0 0 0 0	0.0	0.0								11	9	2
403454747287359488	"""The existence of absolute poverty today points to the indifference of many in the rich world"" http://t.co/ktsjh6vn1Y via @prospect_uk"	['http://www.prospectmagazine.co.uk/magazine/a-c-grayling-what-is-poverty/?utm_content=buffer7eb37&utm_source=buffer&utm_medium=twitter&utm_campaign=Buffer#.Uo3QGtLIbLU']	2	1.0 1.0 0.0 1.0	1 1 1 0	0.75	1.0	0 0 0 0	0.0	0.0	0 0 0 0	0.0	0.0	0 0 0 0	0.0	0.0	0 0 0 0	0.0	0.0					0.9951942			20	20	0
403892923831291905	GTA V Heists demand increases pressure on Rockstar http://t.co/xOduNxypRq #GTAV	['http://xervoo.net/-20FMVR/55fPu?rndad=3249532663-1646866112']	1	1.0 1.0 1.0 1.0	0 0 0 0	0.0	0.0	0 0 0 0	0.0	0.0	0 0 0 0	0.0	0.0	0 0 0 0	0.0	0.0	0 0 0 0	0.0	0.0								16	14	2
404220155028185088	As of 3:51, the Fremont Canyon Weather Station reports sustained winds of 22 MPH (from the NE) with gusts to 34 MPH.	[]	1	1.0 1.0 1.0 0.5	1 0 0 1	0.5	0.5	1 0 0 0	0.25	0.0	1 0 0 1	0.5	0.5	0 0 0 0	0.0	0.0	0 0 0 0	0.0	0.0					0.24668135	0.0007753175500000001	0.0021384086	33	30	3
405233809253089282	Let your hope make you glad. Be patient in time if trouble and never stop praying. #Romans12:12	[]	1	1.0 1.0 1.0 1.0	0 0 0 0	0.0	0.0	0 0 0 0	0.0	0.0	0 0 0 0	0.0	0.0	0 0 0 0	0.0	0.0	0 0 0 0	0.0	0.0								28	26	2
405903081738469376	Leafs played an average game, Pittsburgh's mistakes lead to Leafs goals. Penguins deserved the W..	[]	1	1.0 1.0 1.0 1.0	0 0 0 0	0.0	0.0	0 0 0 0	0.0	0.0	0 0 0 0	0.0	0.0	0 0 0 0	0.0	0.0	0 0 0 0	0.0	0.0								28	23	5
409122595947020288	Who Is Cindy Starfall Promote Cindy Starfall http://t.co/ataFNzowgo another fan vote for @CindyStarfall ;-)	['http://www.starnostar.com/Who-Is-Cindy-Starfall-Is-Cindy-Starfall-from-Saigon-Truly-a-Celebrity/24580/Who-Is-Star/']	1	1.0 1.0 1.0 1.0	0 0 0 0	0.0	0.0	0 0 0 0	0.0	0.0	0 0 0 0	0.0	0.0	0 0 0 0	0.0	0.0	0 0 0 0	0.0	0.0								20	18	2
411247736525434880	Europa, a moon of Jupiter has a gigantic ocean beneath its icy surface which cracks and shoots water jets into space. http://t.co/rcLoSrZE0C	['http://www.newscientist.com/article/dn24743-first-water-plume-seen-firing-from-jupiter-moon-europa.html#.Uqoq9GRDtTS']	1	1.0 1.0 1.0 1.0	1 1 1 1	1.0	1.0	1 1 0 1	0.75	1.0	1 1 0 1	0.75	1.0	1 1 0 0	0.5	0.5	0 0 0 0	0.0	0.0						0.024720466	0.03336972	30	27	3
411681385623982080	#wreckingbaIl Thousands rally to support fired Bogota mayor: Some Colombians believe Petro's dismissal could threaten... @onedirslaytion	[]	1	0.5 0.5 1.0 1.0	0 0 0 0	0.0	0.0	0 0 0 0	0.0	0.0	1 0 0 0	0.25	0.0	0 0 0 0	0.0	0.0	0 0 0 0	0.0	0.0							0.0006531945999999999	36	28	8
412650110460235776	Isis Supports Wells Fargo Visa Cards: Wells Fargo & Co. and Isis ®, the mobile commerce joint venture created ... http://t.co/DxxvRyQ9YZ	['http://www.vendingmarketwatch.com/news/11280860/isis-supports-wells-fargo-visa-cards']	1	1.0 0.5 1.0 1.0	0 0 0 0	0.0	0.0	0 0 0 0	0.0	0.0	0 0 0 0	0.0	0.0	0 0 0 0	0.0	0.0	0 0 0 0	0.0	0.0								34	29	5
412810953659797504	Island in Ha Long Bay eroded due to natural causes at http://t.co/sbQPYgcHT4	['http://vietnamcolors.talkvietnam.com/2013/08/island-in-ha-long-bay-eroded-due-to-natural-causes/']	1	1.0 1.0 0.5 0.5	1 0 0 1	0.5	0.5	0 0 0 0	0.0	0.0	0 0 0 0	0.0	0.0	0 0 0 0	0.0	0.0	0 0 0 0	0.0	0.0					0.0763395			14	14	0
413527115230117888	A lucky find of a toe fossil unlocks a genetic encyclopedia for neanderthals http://t.co/gfjo79RuSv	['https://www.nytimes.com/2013/12/19/science/toe-fossil-provides-complete-neanderthal-genome.html?smid=tw-nytimes']	2	0.5 1.0 1.0 1.0	1 1 0 1	0.75	1.0	1 1 1 1	1.0	1.0	1 1 1 1	1.0	1.0	0 0 0 1	0.25	0.0	0 0 0 0	0.0	0.0					0.6952626999999999			24	20	4
416820259471892481	Damn it! Dragon go back to bed and stop breathing fire everywhere	[]	1	1.0 1.0 1.0 1.0	0 0 0 0	0.0	0.0	0 0 0 0	0.0	0.0	0 0 0 0	0.0	0.0	0 0 0 0	0.0	0.0	0 0 0 0	0.0	0.0								17	15	2
416824906223869952	@mishra_abhi Media stop looking at caste identities & start looking at performance of MLAs/Ministers/officials/policemen @prasannavishy	[]	1	1.0 0.5 1.0 0.5	0 0 0 0	0.0	0.0	0 0 0 0	0.0	0.0	0 0 0 0	0.0	0.0	0 0 0 0	0.0	0.0	0 0 0 0	0.0	0.0								25	22	3
417390745067462656	#WeLoveAndMissYouZayn #OneDirectionPleaseDoAFollowSpreeForNewYears Rt if u support gay rights	[]	1	1.0 1.0 1.0 1.0	0 0 0 0	0.0	0.0	0 0 0 0	0.0	0.0	0 0 0 0	0.0	0.0	0 0 0 0	0.0	0.0	0 0 0 0	0.0	0.0								28	25	3
418044514138591232	Goals for 2014 are as follows: 1) Stop 2) Drop 3) Shut'em down 4) Open up shop.	[]	1	1.0 1.0 1.0 0.5	0 0 0 0	0.0	0.0	0 0 0 0	0.0	0.0	0 0 0 0	0.0	0.0	0 0 0 0	0.0	0.0	0 0 0 0	0.0	0.0								27	26	1
419031039776804864	Hildersham villagers unite to stop pub closure @SouthCambs @Roger_Hickford http://t.co/KvO4SxJkel	['http://www.haverhillecho.co.uk/news/latest-news/hildersham-villagers-unite-to-stop-pub-closure-1-5776936#.UsZ7bnP5XlY.twitter']	1	1.0 1.0 1.0 1.0	0 0 0 0	0.0	0.0	0 0 0 0	0.0	0.0	0 0 0 0	0.0	0.0	0 0 0 0	0.0	0.0	0 0 0 0	0.0	0.0								13	11	2
419047430718373888	.@GreenJournal study show this infection can increase risk of strokes and heart attacks http://t.co/OnPKAwpomh	['http://besthealth.bmj.com/x/news/740468/news-item.html']	1	1.0 1.0 1.0 1.0	1 1 1 1	1.0	1.0	1 1 1 0	0.75	1.0	1 1 1 1	1.0	1.0	0 0 0 1	0.25	0.0	0 0 0 0	0.0	0.0		article with link to study				0.99159944		15	15	0
420227019985932289	Looking for some fun science activities for the cold month ahead? January Science Calendar http://t.co/cGs2nvv7Bx @HSScientist	['https://thehomeschoolscientist.com/calendar/#.UsnpVbRvU6L']	1	1.0 0.5 1.0 1.0	0 0 0 0	0.0	0.0	0 0 0 0	0.0	0.0	0 0 0 1	0.25	0.0	0 0 0 0	0.0	0.0	0 0 0 0	0.0	0.0							0.039446227	17	17	0
424003986866200576	“@ashu_165: #CongBJPquitIndia Stop ur false propaganda http://t.co/Cp5NptVU0Q”#UnitedWithAAP	[]	1	1.0 1.0 1.0 1.0	0 0 0 0	0.0	0.0	0 0 0 0	0.0	0.0	0 0 0 0	0.0	0.0	0 0 0 0	0.0	0.0	0 0 0 0	0.0	0.0								16	14	2
