tweet_id	text	processed_urls	round	confs	cat1_answers	cat1_mean_answer	cat1_final_answer	cat2_answers	cat2_mean_answer	cat2_final_answer	cat3_answers	cat3_mean_answer	cat3_final_answer	compoundclaim_answers	compoundclaim_mean_answer	compoundclaim_final_answer	ironic_answers	ironic_mean_answer	ironic_final_answer	cat1_explanation	cat2_explanation	cat3_explanation	explanation	cat1_score	cat2_score	cat3_score	len_scibert_embed	len_bertweet_embed	embed_len_diff
1100693775620268032	Please send caffeine, because I’m off to London Town today! Double show day and lots of foodie treats and catch ups on the cards... https://t.co/MY0stVCRYP https://t.co/D44rLxh3xc	['http://www.kagraphicdesign.co.uk']	1	1.0 1.0 1.0 1.0	0 0 0 0	0.0	0.0	0 0 0 0	0.0	0.0	0 0 0 0	0.0	0.0	0 0 0 0	0.0	0.0	0 0 0 0	0.0	0.0								35	32	3
1100726830896685056	Modelling Demand-side Energy Policies for Climate Change Mitigation in the UK https://t.co/kobGrDvxeH	['https://ukerc.ac.uk/publications/modelling-demand-side-policies/']	2	1.0 1.0 1.0 1.0	0 0 0 0	0.0	0.0	1 1 1 0	0.75	1.0	1 1 1 0	0.75	1.0	0 0 0 0	0.0	0.0	0 0 0 0	0.0	0.0						0.8676259	0.99546605	15	16	-1
1100871404365451265	Ive done 2 cover ups of ex boyfriends names today. People need to smarten the fuck up and stop getting boyfriend and girlfriends names.	[]	1	1.0 1.0 1.0 1.0	1 0 0 0	0.25	0.0	0 0 0 0	0.0	0.0	0 0 0 0	0.0	0.0	0 0 0 0	0.0	0.0	0 0 0 0	0.0	0.0					0.002945016			36	29	7
1100908185286782976	Network Support Technical Operations Centre Engineer, Reading, £25k - 38k/year + basic + shift allowance 20% + benefits #job #jobs #hiring #RailJobs https://t.co/actXUIoiHq	['http://www.applythis.net/?a=91D384D29.0']	1	1.0 1.0 1.0 1.0	0 0 0 0	0.0	0.0	0 0 0 0	0.0	0.0	0 0 0 0	0.0	0.0	0 0 0 0	0.0	0.0	0 0 0 0	0.0	0.0								40	33	7
1102674464377049089	⛟ #NowHiring: #Shuttle Driver, need more income? Deliver with Uber Eats Uber #Lyft #Postmates #SouthDartmouth #Uber #trucker ☑ Apply Now ☞ https://t.co/aixbxWVCUR https://t.co/MeIRdrM8SL	['https://trucker.city/?p=236811']	1	1.0 1.0 1.0 1.0	0 0 0 0	0.0	0.0	0 0 0 0	0.0	0.0	0 0 0 0	0.0	0.0	0 0 0 0	0.0	0.0	0 0 0 0	0.0	0.0								55	41	14
1102716650045009921	Direct to consumer #wine sales increased by 9% to 6.3 million cases in 2018. One of the biggest growers (12.2%) was Sangiovese. Why not send a bottle to your friends, or order for yourself from Wedding Oak Winery. Shop their online store: https://t.co/tKOe1FXJvh https://t.co/VLBUkGsDxn	['http://bit.ly/wo19sang']	1	0.5 0.0 1.0 1.0	1 0 0 0	0.25	0.0	0 0 0 0	0.0	0.0	0 0 0 0	0.0	0.0	0 0 0 0	0.0	0.0	0 0 0 0	0.0	0.0					0.3125528			65	59	6
1102899669145972736	Today you may be tested. Take a moment, think about potential outcomes before responding then use process of elimination & make a selection. You got this! #SheSPEAKS	[]	1	1.0 1.0 1.0 1.0	0 0 0 0	0.0	0.0	0 0 0 0	0.0	0.0	0 0 0 0	0.0	0.0	0 0 0 0	0.0	0.0	0 0 0 0	0.0	0.0								36	34	2
1103439929030397952	Please Watch & share this powerful TEDx talk by Apollo Sevant that talks about how social & emotional learning & anti bullying workshops can lead to a reduction in school bullying & violence Video Here: https://t.co/6ckcpJGaUM	['https://www.challengeday.org/how-to-prevent-school-shootings/']	1	0.5 0.5 0.5 0.0	1 1 1 1	1.0	1.0	0 0 1 0	0.25	0.0	0 0 1 0	0.25	0.0	1 0 0 1	0.5	0.5	0 0 0 0	0.0	0.0						0.0011010787	0.0012236343	45	41	4
1105136902481592321	RTs are a helluva drug	[]	1	0.0 0.0 1.0 0.0	1 1 0 1	0.75	1.0	0 0 0 0	0.0	0.0	0 0 0 0	0.0	0.0	0 0 0 0	0.0	0.0	0 1 0 1	0.5	0.5					0.040510654			9	7	2
1106858483935109120	Currently in Queensland and there seems to be a fair bit of support for the terrorist and Anning. One bloke said there should be more of it. What the fuck is wrong with this place?	[]	1	1.0 1.0 1.0 1.0	0 0 0 0	0.0	0.0	0 0 0 0	0.0	0.0	0 0 0 0	0.0	0.0	0 0 0 0	0.0	0.0	0 0 0 0	0.0	0.0								44	42	2
1108153258189733888	@thebaqo @chiblkmn1 @shart_objects Facts! and with his scientist sister ooh. and the superpowers... idk man tho. Batman is a better strategist and fighter technique-wise. it's tough.	[]	1	1.0 1.0 1.0 1.0	0 0 0 0	0.0	0.0	0 0 0 0	0.0	0.0	0 0 0 0	0.0	0.0	0 0 0 0	0.0	0.0	0 0 0 0	0.0	0.0								45	38	7
1109012239950897152	❌This account won’t stop so please REPORT, suspend, block . RT and ask all ARMYs https://t.co/MYeRWeLYTv	[]	1	1.0 1.0 1.0 1.0	0 0 0 0	0.0	0.0	0 0 0 0	0.0	0.0	0 0 0 0	0.0	0.0	0 0 0 0	0.0	0.0	0 0 0 0	0.0	0.0								28	27	1
1109164098065965056	How the CAQ anti-hijab bill would affect all Quebecers. My weekend column for @mtlgazette. https://t.co/Oqlkm26Eu6 #qcpoli #polqc #assnat	['http://bit.ly/2HN9VGM']	1	0.5 0.5 1.0 1.0	0 0 0 0	0.0	0.0	0 0 0 0	0.0	0.0	0 0 0 0	0.0	0.0	0 0 0 0	0.0	0.0	0 0 0 0	0.0	0.0	how x -> y							35	31	4
1109183443152392193	Epic branded content efforts to promote @TheGAcademy from @wetheunicorns @global @BenedictTown https://t.co/VuJa1Oa0x2 #ad 🎥 📲 👏 👀	['https://www.youtube.com/watch?v=e9441XJgkrQ&feature=youtu.be']	1	1.0 1.0 1.0 1.0	0 0 0 0	0.0	0.0	0 0 0 0	0.0	0.0	0 0 0 0	0.0	0.0	0 0 0 0	0.0	0.0	0 0 0 0	0.0	0.0								36	29	7
1109583595293868032	#Colombia’s poorer, grid-isolated communities will receive support for the roll-out of domestic #solarPV under new rules unveiled by the Energy ministry. 🇨🇴🌞🇨🇴🌞 #SolarIsNow #GlobalDev #ColombiaHumana https://t.co/5Aysidw5ul	['https://www.pv-tech.org/news/colombia-unveils-subsidy-scheme-for-off-grid-domestic-pv']	1	1.0 1.0 1.0 1.0	1 0 0 0	0.25	0.0	0 0 0 0	0.0	0.0	0 0 0 0	0.0	0.0	0 0 0 0	0.0	0.0	0 0 0 0	0.0	0.0					0.01840151			65	61	4
1110781653889089536	Tourists watch as 18 green turtles are released into the wild on Indonesia's Bali island. The turtles - listed as endangered - were rescued from wildlife smugglers. An estimated 50,000 turtles are killed in Southeast Asia (particularly in Bali) a year, WWF reports https://t.co/RuEdd6CDb4	[]	1	1.0 1.0 1.0 0.5	1 1 1 1	1.0	1.0	1 1 1 0	0.75	1.0	1 1 1 0	0.75	1.0	1 0 1 1	0.75	1.0	0 0 0 0	0.0	0.0						0.0018967343	0.00996948	65	54	11
1111096294435520512	Corruption of Science Contributes to Collapse of Modern Civilization - Publication Prejudice, Fraud, Deceptive Favoritism. Decade + Scientific prejudice, bias, outright deceit endemic to peer-reviewed scientific literature, especially medical, psychiatry https://t.co/QOQZjgmgVt	['https://www.globalresearch.ca/how-the-corruption-of-science-contributes-to-the-collapse-of-modern-civilization/5666220']	1	1.0 1.0 1.0 1.0	1 1 1 1	1.0	1.0	1 1 1 1	1.0	1.0	1 1 1 1	1.0	1.0	1 0 1 0	0.5	0.5	0 0 0 0	0.0	0.0								49	44	5
1111711577231618048	“According to a United Nations inquiry released this month, over 80 percent of the 6,106 protesters wounded in the first nine months of the Great March of Return were shot in the lower limbs.” #LetGazaLive #GreatReturnMarch https://t.co/4WjJ18BPsP	['https://www.middleeasteye.net/news/shoot-maim-how-israel-created-generation-crutches-gaza']	1	1.0 0.0 1.0 0.5	1 1 0 1	0.75	1.0	1 1 0 0	0.5	0.5	1 1 0 0	0.5	0.5	0 0 0 1	0.25	0.0	0 0 0 0	0.0	0.0					0.9904816	0.0009457574	0.0011527544	55	48	7
1112196692051320833	RT @thakurfdn: @thakurfdn announces investigative grants for reporting in #publichealth INR 500,000 for six month reporting assignment; freedom to publish in media-house of your choice. Apply on-line starting April 20, 2019 at https://t.co/4ZBUnqrtaJ https://t.co/8ZLlaqJhM6	['https://twitter.com/thakurfdn/status/1112163229487296512/photo/1', 'https://www.thakur-foundation.org/']	1	0.5 0.0 1.0 0.5	0 0 0 0	0.0	0.0	0 0 0 0	0.0	0.0	1 0 1 1	0.75	1.0	0 0 0 0	0.0	0.0	0 0 0 0	0.0	0.0							0.016650553999999998	47	42	5
1112786198295203845	Aww, two moons also went to support Jongdae, that's cute ❤️ https://t.co/Hkf0ADtruo	[]	1	1.0 1.0 1.0 1.0	0 0 0 0	0.0	0.0	0 0 0 0	0.0	0.0	0 0 0 0	0.0	0.0	0 0 0 0	0.0	0.0	0 0 0 0	0.0	0.0								26	22	4
1113384502615781376	Join us this summer for the Digital Classicist London seminar series: https://t.co/1EznCegdYS. If you can’t attend in person, check out our Youtube Channel: https://t.co/MwhEMMznpC. #DigiClass #digitalhumanities	['http://www.digitalclassicist.org/wip/wip2019.html', 'https://www.youtube.com/channel/UCIamtu1Z62wL5XRk2mE8HKw/videos']	1	1.0 1.0 1.0 0.0	0 0 0 0	0.0	0.0	0 0 1 0	0.25	0.0	0 0 1 0	0.25	0.0	0 0 0 0	0.0	0.0	0 0 0 0	0.0	0.0						0.00085879216	0.0013992998000000002	41	39	2
1113481529005608960	@DrOlufunmilayo Smoking cannabis helps with controlling the nausea that comes with chemotherapy drugs.	[]	2	1.0 1.0 1.0 1.0	1 1 1 1	1.0	1.0	0 0 0 0	0.0	0.0	0 0 0 0	0.0	0.0	0 1 0 0	0.25	0.0	0 0 0 0	0.0	0.0								15	17	-2
1113819787048751105	@du_soleilx Lol nuh bus stop that mean	[]	1	1.0 1.0 1.0 1.0	0 0 0 0	0.0	0.0	0 0 0 0	0.0	0.0	0 0 0 0	0.0	0.0	0 0 0 0	0.0	0.0	0 0 0 0	0.0	0.0								10	8	2
1115564965652574208	BioTechnology – Efficient Stem Cells Can Grow in Animals https://t.co/W5yE3owX8R https://t.co/K24KwiCfXF	['https://endometrioz.su/efficient-stem-cells-can-grow-in-animals/']	2	0.5 1.0 0.5 1.0	1 1 1 1	1.0	1.0	0 1 1 0	0.5	0.0	0 1 1 1	0.75	1.0	0 0 0 0	0.0	0.0	0 0 0 0	0.0	0.0						0.97714263	0.16603516	13	14	-1
1117953601173893121	https://t.co/Slo87kWk9Z People who use marijuana need more anesthesia during medical procedures like endoscopies or colonoscopies. A new study found that they needed 14 percent more fentanyl, 19.6 percent more midazolam, and 220.5 percent more propofol. #sciencenews https://t.co/cKZUq4glyq	['http://bit.ly/2GgAiT1']	1	1.0 1.0 1.0 1.0	1 1 1 1	1.0	1.0	1 1 1 1	1.0	1.0	1 1 1 1	1.0	1.0	1 0 1 1	0.75	1.0	0 0 0 0	0.0	0.0		study referenced in article						55	60	-5
1118968215512727552	.@biorxivpreprint : Primary infection with dengue or #Zika virus does not affect the severity of heterologous secondary infection in macaques. https://t.co/XxWOinyCSd https://t.co/s41FqyHpNp	['https://www.biorxiv.org/content/10.1101/613802v1']	1	1.0 1.0 1.0 1.0	1 1 1 1	1.0	1.0	1 1 1 1	1.0	1.0	1 1 1 1	1.0	1.0	0 0 0 1	0.25	0.0	0 0 0 0	0.0	0.0								27	30	-3
1119503928788340737	baby boy ur literally 18 stop doing these concepts	[]	1	1.0 1.0 1.0 1.0	0 0 0 0	0.0	0.0	0 0 0 0	0.0	0.0	0 0 0 0	0.0	0.0	0 0 0 0	0.0	0.0	0 0 0 0	0.0	0.0								12	11	1
1119616798863839234	A very warm #welcome to all players, family, friends, fans, @HockeyCanada & support staff arriving in @GreaterSudbury for the #ESSOCup #National Female Midget #Hockey #Championship running April 21-27 >>> https://t.co/QFBlyOlq0g #DiscoverSudbury #ThingstoDoinSudbury https://t.co/mwSfX8grYd	['http://bit.ly/2P1PMOX']	1	1.0 1.0 1.0 1.0	0 0 0 0	0.0	0.0	0 0 0 0	0.0	0.0	0 0 0 0	0.0	0.0	0 0 0 0	0.0	0.0	0 0 0 0	0.0	0.0								62	54	8
1119677483723309057	"a fan asked jinsung how kim bin really is behind the camera and jinsung replied ""he sings well, studies hard and is handsome"" and bin replied on his story with ""jung jinsung... thats somewhat pretentious"" https://t.co/TyZt35KcgX"	[]	1	1.0 1.0 1.0 1.0	0 0 0 0	0.0	0.0	0 0 0 0	0.0	0.0	0 0 0 0	0.0	0.0	0 0 0 0	0.0	0.0	0 0 0 0	0.0	0.0								55	46	9
1119868506428731392	Gotta turn the porn off if the guy busts from head cause that shits a lie	[]	1	1.0 1.0 1.0 1.0	1 0 0 0	0.25	0.0	0 0 0 0	0.0	0.0	0 0 0 0	0.0	0.0	0 0 0 0	0.0	0.0	1 0 0 0	0.25	0.0					0.0016380989			22	19	3
1121022173420740608	Facebook and Twitter suspend the accounts of the dissident Irish republican party Saoradh – which has the support of the paramilitary New IRA. https://t.co/TiW2l9UIn5	['https://www.bbc.co.uk/news/uk-northern-ireland-48036849']	1	1.0 1.0 1.0 1.0	0 0 0 0	0.0	0.0	0 0 0 0	0.0	0.0	0 0 0 0	0.0	0.0	0 0 0 0	0.0	0.0	0 0 0 0	0.0	0.0								34	32	2
1121460297523503110	This is my mum, the smiling idiot is my dad and the ugly little shit in the box is me. In 1997 age 33 my mum died due to a rare connective tissue disorder called Ehlers–Danlos syndrome (Type 4) I'm sharing this to spread awareness. Please research EDS, it could save a life. https://t.co/2JC1awU3PK	[]	1	1.0 1.0 0.5 0.0	1 0 0 1	0.5	0.5	0 0 0 0	0.0	0.0	1 0 0 0	0.25	0.0	0 0 0 0	0.0	0.0	0 0 0 0	0.0	0.0					0.9521156		0.0010195931	72	69	3
1122012294563729408	@shiner_sam It's terrible here in liverpool, theres reports that a plant pot has fell over in west derby.	[]	1	1.0 1.0 1.0 1.0	1 0 0 0	0.25	0.0	0 0 0 0	0.0	0.0	0 0 0 0	0.0	0.0	0 0 0 0	0.0	0.0	1 0 0 0	0.25	0.0					0.005797282			27	23	4
1122950495407104001	Canada is brimming with White Supremacist sentiment & you've done a good job of identifying the leaders of the pack. Unfortunately, Christian Fundamentalism is the well spring for this racial bigotry which infests the conservative movement. The public's support is disheartening. https://t.co/sD1DscYFzd	['https://twitter.com/GeoffDembicki/status/1122895258663014406']	1	1.0 0.0 1.0 1.0	1 1 0 0	0.5	0.5	0 0 0 0	0.0	0.0	0 0 0 0	0.0	0.0	1 0 0 0	0.25	0.0	0 0 0 0	0.0	0.0					0.1642991			62	55	7
1123623968462856192	@katythakkar1 @NeilWoodward20 PALM by @AndersonWinkler —> https://t.co/fSN9cntWvB. We used it successfully for this purpose via non-parametric route. Highly recommended piece of remarkably powerful statistical inference software.	['https://fsl.fmrib.ox.ac.uk/fsl/fslwiki/PALM']	1	1.0 1.0 1.0 1.0	0 0 0 0	0.0	0.0	1 0 0 0	0.25	0.0	1 1 0 1	0.75	1.0	0 0 0 0	0.0	0.0	0 0 0 0	0.0	0.0						0.0043961895	0.0037264589	30	32	-2
1125122793698463745	@RepAdamSchiff The Dems need to get tough and fight dirty, just like the Republicans have always done!! We are in CRISIS MODE. Drop the gloves and stop being so polite!!!	[]	1	0.5 1.0 1.0 1.0	1 0 0 0	0.25	0.0	0 0 0 0	0.0	0.0	0 0 0 0	0.0	0.0	0 0 0 0	0.0	0.0	0 0 0 0	0.0	0.0					0.0029952542			43	38	5
1126495297171902465	UnitedHealthcare Helps Support Moms' and Babies' Health Before and After Delivery with New Bundled Payment Program for Maternity Care: Bundled payment program has launched with care providers in New Jersey and Texas with plans to expand to as many as 20… https://t.co/3qdKwECZRW	['http://bioportfol.io/R4N5Mn']	1	1.0 1.0 1.0 1.0	0 0 0 0	0.0	0.0	0 0 0 0	0.0	0.0	0 0 0 0	0.0	0.0	0 0 0 0	0.0	0.0	0 0 0 0	0.0	0.0								53	51	2
1126843813996171264	@eternaIoath Stop listening to sad shit	[]	1	1.0 1.0 1.0 1.0	0 0 0 0	0.0	0.0	0 0 0 0	0.0	0.0	0 0 0 0	0.0	0.0	0 0 0 0	0.0	0.0	0 0 0 0	0.0	0.0								8	7	1
1127710139123949569	"Join us for the Franklin First UMC BioBlitz on Saturday, May 18 at the Franklin First UMC Main Campus. Here scientists, families, students, teachers, and the community work together to get a snapshot of the ""wild"" spaces of our 107-acre campus. Register: https://t.co/wM5M139iqG https://t.co/1A3Eh6gVHO"	['http://bit.ly/bioblitz2019']	1	1.0 1.0 1.0 0.5	0 0 0 0	0.0	0.0	0 0 0 0	0.0	0.0	0 1 1 1	0.75	1.0	0 0 0 0	0.0	0.0	0 0 0 0	0.0	0.0							0.0014573773	62	61	1
1128477362457329665	A newly discovered species of scansoriopterygid dinosaur with bat-like wings is described in Nature. This specimen provides further evidence that dinosaurs closely related to birds experimented with different wing structures near the origins of flight. https://t.co/hQTV6amDuF https://t.co/MtWeqofNEb	['https://go.nature.com/2WxXgMt']	2	1.0 1.0 1.0 1.0	1 1 1 1	1.0	1.0	1 1 1 1	1.0	1.0	1 1 1 1	1.0	1.0	0 0 1 1	0.5	1.0	0 0 0 0	0.0	0.0								50	47	3
1131198181046411264	@carissa_messina @itsNICKSNIDER That’s sad and all but there was no reason to share this stop looking for brownie points.	[]	1	1.0 1.0 1.0 1.0	0 0 0 0	0.0	0.0	0 0 0 0	0.0	0.0	0 0 0 0	0.0	0.0	0 0 0 0	0.0	0.0	0 0 0 0	0.0	0.0								23	22	1
1132591204196069376	Chemicals from plants that may promote health and longevity. @Trends_Endo_Met https://t.co/9LldqOxr4h https://t.co/tYIUgML2GO	['https://www.cell.com/trends/endocrinology-metabolism/pdf/S1043-2760(19)30063-3.pdf']	1	1.0 1.0 1.0 0.5	1 0 0 1	0.5	0.5	1 1 1 1	1.0	1.0	1 1 1 1	1.0	1.0	0 0 0 0	0.0	0.0	0 0 0 0	0.0	0.0	claim component explained by link			Link shows you chemicals from plants that may promote health	0.99370897			12	12	0
1132873918740684804	@TimesNow @narendramodi @myogiadityanath @AditiAnarayanan Truth @BankofAmerica @BofAML #ScheduledCaste atrocity.Conspiracy partner @BofAPrivateBank @HDFC_Bank @AxisBank fraud 2.95Lakh Rs @BJP4India support for no F.I.R. https://t.co/cwPrsDh4JC @sheribronstein @AnneFinucane @CathyBessant @KatyAKnox @Indians #WorstPlaceToWork #SCSTAct	['https://twitter.com/SaveIndianPeopl/status/1126573150798589952?s=19']	1	1.0 1.0 1.0 1.0	0 0 0 0	0.0	0.0	0 0 0 0	0.0	0.0	0 0 0 0	0.0	0.0	0 0 0 0	0.0	0.0	0 0 0 0	0.0	0.0								40	34	6
1134884814866255873	Never trust evangelicals. Whether they be religious, political, or even simpler things like sports or movie fans. People who treat any opposing opinions as heresy are dangerous.	[]	1	0.5 1.0 0.5 0.5	1 0 0 1	0.5	0.5	0 0 0 0	0.0	0.0	0 0 0 0	0.0	0.0	0 0 0 1	0.25	0.0	0 0 0 0	0.0	0.0					0.6710309			39	36	3
1136362028656988161	Only a Tory Government could cut 21,000 Police Officers, sit back & watch crime soar & then proudly announce the recruitment of 1,200 Police Officers as the “biggest increase in Police officer numbers in 10 years!” https://t.co/65Co2sa3VW	[]	1	1.0 1.0 1.0 1.0	1 0 0 0	0.25	0.0	0 0 0 0	0.0	0.0	0 0 0 0	0.0	0.0	0 0 0 0	0.0	0.0	0 0 0 0	0.0	0.0					0.03756866			50	43	7
1136378956544905216	#nltraffic #ducks Encountered this brief traffic stop on the CBS bypass road this evening! Big shout out to the wonderful police officer! 😃❤️👍 https://t.co/WKVrCf1PkU	[]	1	1.0 1.0 1.0 1.0	0 0 0 0	0.0	0.0	0 0 0 0	0.0	0.0	0 0 0 0	0.0	0.0	0 0 0 0	0.0	0.0	0 0 0 0	0.0	0.0								58	47	11
1136783586118512640	"New ""Call Of Duty"" Video Game Encourages Support For The White Helmets https://t.co/X6cKTAKHd2"	['https://www.zerohedge.com/news/2019-06-06/new-call-duty-video-game-encourages-support-white-helmets']	1	1.0 1.0 1.0 1.0	0 0 0 0	0.0	0.0	0 0 0 0	0.0	0.0	0 0 0 0	0.0	0.0	0 0 0 0	0.0	0.0	0 0 0 0	0.0	0.0								17	16	1
1138860977716379648	A total of $1754 was raised by the #AOCC2019 assembly to support Pikangikum. Miigwech for your support! @ChiefsofOntario @ORCRoseAnne @ECAlertezON55 https://t.co/O4WsRFxduA	[]	1	1.0 1.0 1.0 1.0	0 0 0 0	0.0	0.0	0 0 0 0	0.0	0.0	0 0 0 0	0.0	0.0	0 0 0 0	0.0	0.0	0 0 0 0	0.0	0.0								33	32	1
1139163111775232001	“Stronger relationships lead to stronger communities. Stronger communities are what makes America, America.” Read the full story SuccessBeyond the Front Lines from @southmagazine: https://t.co/wZvIVZzyTg | #GORUCK https://t.co/1ZZHIXCeU4	['https://bit.ly/2ZnqnTM']	1	1.0 1.0 0.5 0.5	1 1 0 1	0.75	1.0	0 0 0 0	0.0	0.0	0 0 0 0	0.0	0.0	1 0 0 0	0.25	0.0	0 0 0 0	0.0	0.0					0.9969478			37	35	2
1140197127387254784	@berniewestacott Play in early years is so important. The almost complete disappearance of unregulated, unmonitored, unsupervised free play in childhood is one of the key drivers of the increase in mental health issues. Schools can help: more unsupervised play, longer breaks, longer lunch, etc	[]	2	1.0 1.0 1.0 1.0	1 1 1 1	1.0	1.0	0 0 0 0	0.0	0.0	0 0 0 0	0.0	0.0	1 1 1 0	0.75	1.0	0 0 0 0	0.0	0.0								58	57	1
1140306029160423424	QUOTE “I observed this 2,500-year-old shaman, and he had mortar that had been caked in cannabis with him. That was a remarkable find.” END QUOTE https://t.co/ZKkwI6KW0F	['https://www.scientificamerican.com/article/using-marijuana-to-get-high-dates-back-millennia/']	1	1.0 1.0 1.0 1.0	0 0 0 0	0.0	0.0	0 0 1 0	0.25	1.0	0 0 1 0	0.25	1.0	0 0 0 0	0.0	0.0	0 0 0 1	0.25	0.0		study mentioned in article				0.0013029554	0.043653704	41	37	4
1140346922684882945	Soccer aid, where 2 squads of millionaires kick a ball about while asking the working class to support charity, baffling	[]	1	1.0 1.0 1.0 1.0	0 0 0 0	0.0	0.0	0 0 0 0	0.0	0.0	0 0 0 0	0.0	0.0	0 0 0 0	0.0	0.0	0 0 0 0	0.0	0.0								31	24	7
1141149641242816512	@RayyZhane True but other carnivals are a week or more long. Ours just seems so rushed	[]	1	1.0 1.0 1.0 1.0	0 0 0 0	0.0	0.0	0 0 0 0	0.0	0.0	0 0 0 0	0.0	0.0	0 0 0 0	0.0	0.0	0 0 0 0	0.0	0.0								21	19	2
1141480794118152192	Kefir Health Benefits: Kefir Milk Grains last indefinitely. Kefir evidence suggests probiotics can alleviate many digestive problems, incl. irritable bowel syndrome & ulcers from H. pylori infection BUY HERE https://t.co/UXq872e3Oq https://t.co/Omddg6LmLE	['http://bonanza.com/listings/727498215']	2	1.0 1.0 1.0 1.0	1 1 1 1	1.0	1.0	0 0 0 0	0.0	0.0	0 0 0 0	0.0	0.0	1 1 0 1	0.75	1.0	0 0 0 0	0.0	0.0								43	46	-3
1142057725398069248	Teacher: What do want to do when you older? Normal kids: doctor, pilot, engineer etc... Weebs: I want to get knocked by a truck and die, so I can be sent to an isekai world and have a harem of girls. https://t.co/J5T9BKVgA1	[]	1	1.0 1.0 1.0 1.0	0 0 0 0	0.0	0.0	0 0 0 0	0.0	0.0	0 0 0 0	0.0	0.0	0 0 0 0	0.0	0.0	0 0 0 0	0.0	0.0								60	55	5
1143919694249910273	"@jwvansteenwyk @Kira_Media @KurtSchlichter ""It has nothing to do with discrimination."" Section 230 States you can't ban people for Political Opinions. 👇 https://t.co/Vld9KuOr5x Facebook 1,565,118 Conservatives banned 24 Liberal banned. Maybe open a book sometime. https://t.co/baXtDOyZik"	['https://www.eff.org/issues/cda230', 'https://twitter.com/JayCaruso/status/1143914212000960518']	1	1.0 1.0 1.0 1.0	1 0 0 0	0.25	0.0	0 0 0 0	0.0	0.0	0 0 0 0	0.0	0.0	0 0 0 0	0.0	0.0	0 0 0 0	0.0	0.0					0.035684362000000004			58	45	13
1144969129633308672	Side effect of Alcohol & Plastic surgery. 🤣	[]	2	0.5 0.0 1.0 1.0	0 0 0 0	0.0	0.0	0 0 0 0	0.0	0.0	0 0 0 0	0.0	0.0	0 0 0 0	0.0	0.0	0 0 0 1	0.25	0.0								14	14	0
1145012175418867714	UN and EU propaganda by socialist media compares 2019 data of built surfaces with 2003 data of tampered temperature database. Fact: France has a record 50°C heat wave in 1930 and similar and higher temperature in Spain etc. https://t.co/jtGv6gqhq3	['https://twitter.com/NBCNews/status/1144992447749066755']	1	1.0 1.0 0.5 0.5	1 1 1 1	1.0	1.0	0 0 0 0	0.0	0.0	0 0 0 1	0.25	0.0	0 0 1 0	0.25	0.0	0 0 0 0	0.0	0.0							0.00573024	50	46	4
1145304535532883970	Really wish there is a way to stop all these pain.	[]	1	1.0 1.0 1.0 1.0	0 0 0 0	0.0	0.0	0 0 0 0	0.0	0.0	0 0 0 0	0.0	0.0	0 0 0 0	0.0	0.0	0 0 0 0	0.0	0.0								14	14	0
1145516423382306816	@OccupyForJesus: 1 Peter 2:9 (KJV) But ye are a chosen generation, a royal priesthood, an holy nation, a peculiar people; that ye should...	[]	1	1.0 1.0 1.0 1.0	0 0 0 0	0.0	0.0	0 0 0 0	0.0	0.0	0 0 0 0	0.0	0.0	0 0 0 0	0.0	0.0	0 0 0 0	0.0	0.0								40	36	4
1146246937034842114	When it comes to immigration, this is often left out of the conversation: The United States’s weak gun laws not only put American lives at risk but drive illegal gun trafficking and violence in Latin America. https://t.co/TIZrZLvWlu	['http://giffords.me/93907']	2	0.5 0.5 0.5 1.0	1 1 1 0	0.75	1.0	0 0 0 0	0.0	0.0	0 0 0 0	0.0	0.0	1 0 1 0	0.5	1.0	0 0 0 0	0.0	0.0					0.99647367			49	50	-1
1148123355297529856	Why would the #USWNT deserve equal pay with men when they can be beaten by an under 15s boys team? Pay on ability, reward on performance, promote on merit. 15 year old boys are more able than this team Facts don’t care about your feelings. https://t.co/iY4jziil1Z	[]	1	0.5 0.5 1.0 1.0	1 0 0 0	0.25	0.0	0 0 0 0	0.0	0.0	0 0 0 0	0.0	0.0	0 0 0 0	0.0	0.0	0 0 0 0	0.0	0.0					0.9910366			60	56	4
1148137607542558721	💔say something-a great big world 💔how to never stop being sad-dandelion hands 💔latch (acoustic)-Sam Smith 💔supermarket flowers-Ed Sheeran	[]	1	1.0 1.0 1.0 1.0	0 0 0 0	0.0	0.0	0 0 0 0	0.0	0.0	0 0 0 0	0.0	0.0	0 0 0 0	0.0	0.0	0 0 0 0	0.0	0.0								56	53	3
1148953093494779904	A @renditionprjct report released today presents, for the first time, a comprehensive overview of the CIA’s black site network, drawing on new data derived from an unprecedented analysis of the Senate Committee's 2014 study of CIA detention. https://t.co/hUBy640ZuF	['https://www-test.therenditionproject.org.uk/documents/RDI/190710-TRP-TBIJ-CIA-Torture-Unredacted-Full.pdf']	1	0.5 0.0 1.0 1.0	0 1 0 0	0.25	0.0	0 0 0 0	0.0	1.0	1 0 0 0	0.25	1.0	0 0 0 0	0.0	0.0	0 0 0 0	0.0	0.0			research project		0.009625519		0.076641835	50	46	4
1149293343802720257	I could also add to the pile of evidence thr neurological studies on how poverty affects the brain as shiwn below. This unprecedented study shows how much of an impact the environment can make. https://t.co/is8bzNWQ3P	['https://www.nature.com/news/how-poverty-affects-the-brain-1.22280']	1	1.0 1.0 1.0 1.0	1 1 1 1	1.0	1.0	1 1 1 1	1.0	1.0	1 1 1 1	1.0	1.0	0 0 0 0	0.0	0.0	0 0 0 0	0.0	0.0	how x -> y							39	40	-1
1149595223250485248	Posted blog with @schweitzer_va on @JAMAInternalMed study on a bundle to improve outcome in patients with community-acquired pneumonia. https://t.co/NSFsadd35G	['https://reflectionsipc.com/2019/07/12/how-a-bundle-kills-cochrane-or-not-2/']	2	1.0 0.5 1.0 1.0	0 0 0 1	0.25	0.0	1 1 1 1	1.0	1.0	1 1 1 1	1.0	1.0	0 0 0 1	0.25	0.0	0 0 0 0	0.0	0.0		study referenced in article			0.7181298			21	21	0
1149679630833672192	😢😢 Willy Wonka star Denise Nickerson taken off life support https://t.co/1aA3jXPuXy	['https://twitter.com/i/events/1149063924953698304']	1	1.0 1.0 1.0 1.0	0 0 0 0	0.0	0.0	0 0 0 0	0.0	0.0	0 0 0 0	0.0	0.0	0 0 0 0	0.0	0.0	0 0 0 0	0.0	0.0								27	24	3
1150075644434354176	Why is the new JSF page so difficult to navigate?	[]	1	1.0 1.0 1.0 1.0	0 0 0 0	0.0	0.0	0 0 0 0	0.0	0.0	0 0 0 0	0.0	0.0	0 0 0 0	0.0	0.0	0 0 0 0	0.0	0.0								14	14	0
1150742079850442754	Race/Ethnicity and Neighborhood Characteristics Are Associated With Bystander Cardiopulmonary Resuscitation in Pediatric... https://t.co/TkSNb66VOi	['https://misuse.ncbi.nlm.nih.gov/error/abuse.shtml?utm_source=dlvr.it&utm_medium=twitter']	1	1.0 1.0 1.0 1.0	1 1 1 1	1.0	1.0	1 1 0 0	0.5	1.0	1 1 0 1	0.75	1.0	1 0 0 0	0.25	0.0	0 0 0 0	0.0	0.0		link to study				0.9922781	0.9970181	21	28	-7
1151610179382890496	@Spelmanites I hope that young man has texts or witnesses cause I was ignored at CAU with my lack of proof. This was in 2002. Not much has changed. Title 9 should see it through. Unpaid leave is not enough.	[]	1	1.0 0.5 1.0 0.5	0 0 0 0	0.0	0.0	0 0 0 0	0.0	0.0	0 0 0 0	0.0	0.0	0 0 0 0	0.0	0.0	0 0 0 0	0.0	0.0								50	47	3
